{
  "above_threshold": false,
  "auto_fixable": {
    "rector_official_files": 0,
    "rector_official_rules": {}
  },
  "core_removals": [],
  "core_target": {
    "bc_break": false,
    "composer_core_constraint": "^10.3 || ^11",
    "d10_support": "declared-not-verified",
    "php_floor_detected": "8.1",
    "php_floor_target_compatible": true,
    "rationale": [
      "Strategy: keep-d10 ('^10.3 || ^11').",
      "Drupal 10 floor 10.3: the declared minor floor ('^10.3') is kept, never lowered.",
      "Detected PHP floor is 8.1 (heuristic scan), below the target 8.3 — require.php is widened to \">=8.1\" for genuine Drupal 10 (PHP 8.1) support.",
      "Adding Drupal 11 support without dropping a supported core major -> MINOR."
    ],
    "recommended_core_version_requirement": "^10.3 || ^11",
    "require_php": ">=8.1",
    "strategy": "keep-d10",
    "version_bump": "minor",
    "warnings": [
      "require.php was lowered to \">=8.1\" from a best-effort syntactic scan. CONFIRM with PHPCompatibility (testVersion 8.1-) before release: a missed newer construct would let a Drupal 10 + PHP<8.3 site install and then fatal at runtime. Set DRUPILOT_REQUIRE_PHP_FLOOR=target to keep the conservative \">=8.3\".",
      "Drupal 10's own minimum is PHP 8.1, but this port's floor is 8.1. require.php \">=8.1\" blocks D10 sites below that floor at install time (composer) rather than fataling at runtime. If you do not need the D10 transition window, drop to '^11'.",
      "This module has no composer.json, so require.php cannot be declared anywhere — an info.yml-only '^10 || ^11' module has NO way to enforce the PHP floor, and a D10 + low-PHP site would install and fatal. Either add a composer.json with \"require\": { \"php\": \">=8.1\" }, or declare '^11' only.",
      "Drupal 10 compatibility is DECLARED, not verified. drupal-rector's standard replacements are usually available across all of Drupal 10 (deprecation contract), but this was not checked here. If the port uses an API added in a later 10.x minor, set core_version_requirement to e.g. '^10.3 || ^11'; if it uses an API absent from Drupal 10, drop to '^11'. The AI digests / ad-hoc Rector layer may introduce replacements newer than Drupal 10.0, so a raised minor (e.g. '^10.3 || ^11') is more likely — check it."
    ]
  },
  "current_core_version_requirement": "^10.3",
  "dependencies": {
    "blockers": 0,
    "list": [],
    "offline": true,
    "ready": 0,
    "unknown": 0
  },
  "deprecations_hard": 0,
  "deprecations_soft": 0,
  "deprecations_unknown": 0,
  "digest_algo": 2,
  "drupal_target": "^11",
  "effort": "S",
  "findings_hash": "sha256:7ae0922d32c50405a02714b54995a5cdc7639a37ad71fdbb095c3b84a5c44138",
  "hard_break_categories": {
    "ckeditor5": [],
    "jquery4": [],
    "jquery_ui": [],
    "symfony7": [],
    "twig3": []
  },
  "hard_breaks": [],
  "hygiene": {
    "error": 0,
    "info": 0,
    "warn": 0
  },
  "info_yml": {
    "core_version_requirement_present": true,
    "d11_compatible": false,
    "submodules_d11_compatible": true
  },
  "machine_name": "acme_core",
  "manual_items": [],
  "no_verdict": [],
  "php_target": "8.3",
  "phpcs": {
    "count": 2
  },
  "phpstan": {
    "count": 1,
    "deprecations": 0
  },
  "provisional": false,
  "recommended_core_version_requirement": "^10.3 || ^11",
  "require_php": ">=8.1",
  "rubric": {
    "blocking_deps": 0,
    "hard_breaks": 0,
    "manual": 0,
    "rule": "S: hard_breaks == 0 and manual < 5 and blocking_deps == 0"
  },
  "schema": 1,
  "soft_deprecations": [],
  "soft_deprecations_policy": "report",
  "subject": "web/modules/custom/acme_core",
  "subject_digest": "4ff2c3678b7a6f26892219451e3244eaa08f04b667c3abd1b11298f88869f196",
  "tool": "assess",
  "tools": {
    "metadata": "ok",
    "phpcs": "ok",
    "phpstan": "ok",
    "port-safety": "ok",
    "rector": "ok",
    "signatures": "ok"
  },
  "type": "module",
  "verdict": "S",
  "version_bump": "minor",
  "viability_threshold": "M",
  "worklist": {
    "by_lane": {
      "ai-free": 1,
      "deferred": 1
    },
    "items": 2,
    "open": 1
  },
  "worklist_hash": "sha256:7818547245c9f6efbda65f0221f5d49141a4ac6249c118eb927cb444904d32e6"
}
